{
  "schema_version": "1.0.0",
  "status": "REVIEW_PACKET_WITH_EXPLICIT_GAPS",
  "summary": {
    "source": {
      "repository": "https://github.com/cloudflare/cloudflare-os",
      "commit": "1cb5e3d9096589e38f3fcfaf3f2191aa95a4c592",
      "tree": "2f1eb7b69cf6cbc0e0da159bf2cd09ef9a2ce7e7"
    },
    "baseline": {
      "commit": "bf7f762d7fa73553284d731ab6a978d3ea17be24",
      "tree": "023da57719fa9744a4ca909f9c3863c93cb614fa"
    },
    "changed_counts": {
      "files": 99,
      "added_lines": 19090,
      "deleted_lines": 1627
    },
    "actual_read_count": 79,
    "inventoried_count": 99,
    "partial_read_count": 20,
    "read_definition": "Complete means every fixed-endpoint diff hunk was semantically read; not full unchanged source or runtime execution. Generated per-file headers/provenance are partial reads.",
    "findings": [
      "Toolchain/dependency drift requires refreshed exact-install provenance and cross-platform compatibility evidence.",
      "Context/scheduler preinstall+singleton requires owner policy decision and deploy-service enforcement, retaining Context Gateway and personal/shared authority boundaries.",
      "Trace enablement/attributes require privacy-retention and quota-budget decisions.",
      "Observer grant expansion and legacy/unknown metadata readiness need focused verification under backend capability authority.",
      "Snapshot threshold increase requires replay/restart regression evidence."
    ],
    "coverage_gaps": [
      "packages/gatekeeper-cloudflare/worker-configuration.d.ts",
      "packages/gatekeeper-confluence/worker-configuration.d.ts",
      "packages/gatekeeper-context/worker-configuration.d.ts",
      "packages/gatekeeper-email/worker-configuration.d.ts",
      "packages/gatekeeper-github/worker-configuration.d.ts",
      "packages/gatekeeper-google/worker-configuration.d.ts",
      "packages/gatekeeper-homeassistant/worker-configuration.d.ts",
      "packages/gatekeeper-linear/worker-configuration.d.ts",
      "packages/gatekeeper-mcp-portal/worker-configuration.d.ts",
      "packages/gatekeeper-mcp/worker-configuration.d.ts",
      "packages/gatekeeper-notion/worker-configuration.d.ts",
      "packages/gatekeeper-scheduler/worker-configuration.d.ts",
      "packages/gatekeeper-slack/worker-configuration.d.ts",
      "packages/gatekeeper-spotify/worker-configuration.d.ts",
      "packages/gatekeeper-supabase/worker-configuration.d.ts",
      "packages/gatekeeper-zoominfo/worker-configuration.d.ts",
      "packages/mcp-shared/worker-configuration.d.ts",
      "packages/router/worker-configuration.d.ts",
      "packages/workshop-backend/worker-configuration.d.ts",
      "pnpm-lock.yaml"
    ],
    "no_adoption": true,
    "no_provider": true,
    "no_independence_acceptance": true,
    "scope": "Static fixed public Git endpoint API/spec compatibility review only; no vulnerability scan, runtime exposure proof, full safety guarantee or current HEAD alignment claim.",
    "tests_executed": [],
    "effects": {
      "source_edits": 0,
      "upstream_execution": 0,
      "dependency_install": 0,
      "provider_mutation": 0,
      "credential_operation": 0,
      "external_post": 0,
      "repin": 0
    },
    "owner_gates": [
      "Independence acceptance",
      "Re-pin decision",
      "Context/scheduler ambient capability policy",
      "Privacy-retention/budget and provider E2E acceptance"
    ],
    "issue_read": {
      "repository": "Kotodama-Project/Kotodama-project",
      "number": 11,
      "body": true,
      "comments": true
    }
  },
  "$schema": "../../schemas/cloudflare-os-upstream-drift-review.schema.json",
  "reader_packet_sha256": "d1814c07a8174301dc47ce24a7f63b7d99db295e95dbb1394c1c834f0714fcde",
  "files": [
    {"path":".github/workflows/bonk-pr.yml","old_blob":"0000000000000000000000000000000000000000","new_blob":"b15b26f30616b2fba178c3f2efef27517578191b","change_type":"A","read_complete":true,"risk":"high","concrete_notes":["New workflow fully diff-read: Bonk uses third-party action with repository write permissions and provider-secret references; CLA uses target/comment triggers and write scopes; CI installs fixed lock then lints/builds/tests. Importing upstream automation requires separate repo/credential-owner scope."],"tests_relevant":["Static workflow permission/event policy review"],"unresolved":["Upstream external automation must not inherit Kotodama authorization"],"review_mode":"complete_fixed_endpoint_diff","added_lines":39,"deleted_lines":0},
    {"path":".github/workflows/bonk.yml","old_blob":"0000000000000000000000000000000000000000","new_blob":"2efcf2702dd54ed48981dc9109194eaeecdcf44a","change_type":"A","read_complete":true,"risk":"high","concrete_notes":["New workflow fully diff-read: Bonk uses third-party action with repository write permissions and provider-secret references; CLA uses target/comment triggers and write scopes; CI installs fixed lock then lints/builds/tests. Importing upstream automation requires separate repo/credential-owner scope."],"tests_relevant":["Static workflow permission/event policy review"],"unresolved":["Upstream external automation must not inherit Kotodama authorization"],"review_mode":"complete_fixed_endpoint_diff","added_lines":40,"deleted_lines":0},
    {"path":".github/workflows/ci.yml","old_blob":"0000000000000000000000000000000000000000","new_blob":"879d0f3c6127522a709c14bf08c6a2218ee3d437","change_type":"A","read_complete":true,"risk":"medium","concrete_notes":["New workflow fully diff-read: Bonk uses third-party action with repository write permissions and provider-secret references; CLA uses target/comment triggers and write scopes; CI installs fixed lock then lints/builds/tests. Importing upstream automation requires separate repo/credential-owner scope."],"tests_relevant":["Static workflow permission/event policy review"],"unresolved":["Upstream external automation must not inherit Kotodama authorization"],"review_mode":"complete_fixed_endpoint_diff","added_lines":63,"deleted_lines":0},
    {"path":".github/workflows/cla.yml","old_blob":"0000000000000000000000000000000000000000","new_blob":"8f62d5331762854303a92d238ccacb3c380cc882","change_type":"A","read_complete":true,"risk":"high","concrete_notes":["New workflow fully diff-read: Bonk uses third-party action with repository write permissions and provider-secret references; CLA uses target/comment triggers and write scopes; CI installs fixed lock then lints/builds/tests. Importing upstream automation requires separate repo/credential-owner scope."],"tests_relevant":["Static workflow permission/event policy review"],"unresolved":["Upstream external automation must not inherit Kotodama authorization"],"review_mode":"complete_fixed_endpoint_diff","added_lines":30,"deleted_lines":0},
    {"path":"README.md","old_blob":"e0c2f29557d3437a57cd7721ef3955bea24238ee","new_blob":"967344201ece8f3ed65f5b1f4b1c019a18e2d9ab","change_type":"M","read_complete":true,"risk":"low","concrete_notes":["Deployment links now target the hosted wizard; credits added. This does not establish runtime support or authorize deployment."],"tests_relevant":["Focused package unit/type tests for described change; not executed"],"unresolved":[],"review_mode":"complete_fixed_endpoint_diff","added_lines":11,"deleted_lines":2},
    {"path":"package.json","old_blob":"0446b9c9635df2b9a505a063f4d8da95f9c4775e","new_blob":"7a4f5f1bb1119adeada457ac34f2ff2083f097dd","change_type":"M","read_complete":true,"risk":"high","concrete_notes":["Renames root package, pins pnpm 11.17.0 with archive digest, adds types generation, raises Wrangler to 4.119.0. Prior exact-install receipts do not cover these bytes."],"tests_relevant":["Focused package unit/type tests for described change; not executed"],"unresolved":["Owner adoption decision and focused verification remain pending; review does not authorize re-pin"],"review_mode":"complete_fixed_endpoint_diff","added_lines":5,"deleted_lines":3},
    {"path":"packages/backend-utils/__tests__/tracing.test.ts","old_blob":"0000000000000000000000000000000000000000","new_blob":"de9529024c53b2b3cf70c13d7d6ffcab5797c3c3","change_type":"A","read_complete":true,"risk":"low","concrete_notes":["Adds real-workerd tests for span lifetime across awaits and tagging errors before rejection closes span; tests are source-read, not executed evidence."],"tests_relevant":["Focused package unit/type tests for described change; not executed"],"unresolved":[],"review_mode":"complete_fixed_endpoint_diff","added_lines":49,"deleted_lines":0},
    {"path":"packages/backend-utils/package.json","old_blob":"a58af7f9db1fe09cc229dca5d2ce2fc076dd0e55","new_blob":"a2408e48d859fd1179c64852b45ed722b4447b90","change_type":"M","read_complete":true,"risk":"medium","concrete_notes":["Fully diff-read dependency manifest: package-specific Wrangler/Vitest/worker-pool/Workers-types or React-plugin versions advance; scheduler moves Miniflare to alpha and MCP shared switches to generated runtime types. Previous baseline tests do not cover changed graph."],"tests_relevant":["Package build/type/lint/unit tests with exact lockfile"],"unresolved":["Updated toolchain provenance/compatibility not executed"],"review_mode":"complete_fixed_endpoint_diff","added_lines":6,"deleted_lines":2},
    {"path":"packages/backend-utils/src/tracing.ts","old_blob":"0000000000000000000000000000000000000000","new_blob":"1bf5d9360404adfa6eae55be01259d7fd84826ba","change_type":"A","read_complete":true,"risk":"medium","concrete_notes":["New cloudflare:workers tracing helper copies bounded scalar observability context, marks failure with boolean attribute, wraps native Promise rejection, and explicitly excludes pipelined RPC stubs. Identifiers still need retention approval."],"tests_relevant":["Focused package unit/type tests for described change; not executed"],"unresolved":[],"review_mode":"complete_fixed_endpoint_diff","added_lines":46,"deleted_lines":0},